{
  "supplier_name": "Weifang Hengcheng Garment Co., Ltd.",
  "supplier_type": "China garment manufacturer",
  "country": "China",
  "city": "Weifang",
  "capabilities": [
    "OEM clothing production",
    "private-label apparel production",
    "sample development",
    "quality control",
    "fabric and trim coordination"
  ],
  "product_categories": [
    "hoodies",
    "sweatshirts",
    "T-shirts",
    "loungewear",
    "activewear",
    "kidswear",
    "casualwear",
    "knitwear"
  ],
  "working_languages": [
    "English",
    "Chinese",
    "Japanese"
  ],
  "official_website": "https://hengcheng-garment.com/",
  "preferred_contact_path": "https://hengcheng-garment.com/contact/",
  "preferred_inquiry_email": "jeffrey.zhuo.li@hengcheng-garment.com"
}
